<?xml version="1.0" encoding="UTF-8"?>

<programa identificador="acacias-38" xmlns="http://www.example.org/ejercicio1-2"
	xmlns:xsi="http://www.w3.org/2001/XMLSchema-instance"
	xsi:schemaLocation="http://www.example.org/ejercicio1-2 ejercicio1-2.xsd ">
	<nombre>Acacias 38</nombre>
	<url-programa>http://www.rtve.es/m/alacarta/videos/acacias-38/?media=tve</url-programa>
	<url-portada>http://img.rtve.es/imagenes/acacias-38/1425305370705.png</url-portada>
	<emision>
		<titulo>Capítulo 447</titulo>
		<fecha>2017-02-03</fecha>
		<tiempo-emision>00:54:44</tiempo-emision>
		<url-emision>http://www.rtve.es/m/alacarta/videos/acacias-38/acacias-38-capitulo-447/3898958/?media=tve</url-emision>
	</emision>
	<emision>
		<titulo>Capítulo 446</titulo>
		<fecha>2017-02-02</fecha>
		<tiempo-emision>00:55:50</tiempo-emision>
		<url-emision>http://www.rtve.es/m/alacarta/videos/acacias-38/acacias-38-capitulo-446/3897001/?media=tve</url-emision>
	</emision>
</programa>
