<?xml version="1.0" encoding="UTF-8"?>

<e:programa identificador="acacias-38"
	xmlns:e="http://www.example.org/ejercicio1-2" xmlns:xsi="http://www.w3.org/2001/XMLSchema-instance"
	xsi:schemaLocation="http://www.example.org/ejercicio1-2 ejercicio1-2.xsd ">
	<e:nombre>Acacias 38</e:nombre>
	<e:url-programa>
		http://www.rtve.es/m/alacarta/videos/acacias-38/?media=tve</e:url-programa>
	<e:url-portada>
		http://img.rtve.es/imagenes/acacias-38/1425305370705.png</e:url-portada>
	<e:emision>
		<e:titulo>
			Capítulo 447
		</e:titulo>
		<e:fecha>2017-02-03</e:fecha>
		<e:tiempo-emision>
			00:54:44
		</e:tiempo-emision>
		<e:url-emision>
			http://www.rtve.es/m/alacarta/videos/acacias-38/acacias-38-capitulo-447/3898958/?media=tve</e:url-emision>
	</e:emision>
	<e:emision>
		<e:titulo>
			Capítulo 446
		</e:titulo>
		<e:fecha>2017-02-02</e:fecha>
		<e:tiempo-emision>
			00:55:50
		</e:tiempo-emision>
		<e:url-emision>
			http://www.rtve.es/m/alacarta/videos/acacias-38/acacias-38-capitulo-446/3897001/?media=tve</e:url-emision>
	</e:emision>
</e:programa>
